{
  "$schema": "https://json-schema.org/draft/2020-12/schema",
  "$id": "https://asset-forge.local/runtime-atlas.schema.json",
  "title": "Asset Forge Runtime Atlas",
  "type": "object",
  "required": ["format", "version", "image", "imageSize", "frameCount", "capabilities", "frames"],
  "additionalProperties": false,
  "properties": {
    "format": {"const": "asset-forge-runtime-atlas"},
    "version": {"const": 1},
    "image": {"type": "string", "minLength": 1},
    "imageSize": {
      "type": "object",
      "required": ["width", "height"],
      "additionalProperties": false,
      "properties": {
        "width": {"type": "integer", "minimum": 1},
        "height": {"type": "integer", "minimum": 1}
      }
    },
    "frameCount": {"type": "integer", "minimum": 1},
    "capabilities": {
      "type": "object",
      "required": ["trimOffsets", "clockwise90Rotation"],
      "additionalProperties": false,
      "properties": {
        "trimOffsets": {"const": true},
        "clockwise90Rotation": {"const": true}
      }
    },
    "animations": {
      "type": "array",
      "minItems": 1,
      "items": {
        "type": "object",
        "required": ["name", "fps", "loop", "frames"],
        "additionalProperties": false,
        "properties": {
          "name": {"type": "string", "minLength": 1},
          "fps": {"type": "number", "exclusiveMinimum": 0},
          "loop": {"type": "boolean"},
          "frames": {
            "type": "array",
            "minItems": 1,
            "items": {
              "type": "object",
              "required": ["index", "duration"],
              "additionalProperties": false,
              "properties": {
                "index": {"type": "integer", "minimum": 0},
                "duration": {"type": "number", "exclusiveMinimum": 0}
              }
            }
          }
        }
      }
    },
    "frames": {
      "type": "array",
      "minItems": 1,
      "items": {
        "type": "object",
        "required": ["index", "atlasRegion", "uv", "sourceRegion", "sourceSize", "trimOffset", "rotation"],
        "additionalProperties": false,
        "properties": {
          "index": {"type": "integer", "minimum": 0},
          "name": {"type": ["string", "null"]},
          "atlasRegion": {"$ref": "#/$defs/rect"},
          "uv": {
            "type": "object",
            "required": ["u0", "v0", "u1", "v1"],
            "additionalProperties": false,
            "properties": {
              "u0": {"type": "number", "minimum": 0, "maximum": 1},
              "v0": {"type": "number", "minimum": 0, "maximum": 1},
              "u1": {"type": "number", "minimum": 0, "maximum": 1},
              "v1": {"type": "number", "minimum": 0, "maximum": 1}
            }
          },
          "sourceRegion": {"$ref": "#/$defs/size"},
          "sourceSize": {"$ref": "#/$defs/size"},
          "trimOffset": {
            "type": "object",
            "required": ["x", "y"],
            "additionalProperties": false,
            "properties": {
              "x": {"type": "integer", "minimum": 0},
              "y": {"type": "integer", "minimum": 0}
            }
          },
          "rotation": {
            "type": "object",
            "required": ["rotated", "degreesClockwise"],
            "additionalProperties": false,
            "properties": {
              "rotated": {"type": "boolean"},
              "degreesClockwise": {"enum": [0, 90]}
            }
          }
        }
      }
    }
  },
  "$defs": {
    "size": {
      "type": "object",
      "required": ["width", "height"],
      "additionalProperties": false,
      "properties": {
        "width": {"type": "integer", "minimum": 1},
        "height": {"type": "integer", "minimum": 1}
      }
    },
    "rect": {
      "type": "object",
      "required": ["x", "y", "width", "height"],
      "additionalProperties": false,
      "properties": {
        "x": {"type": "integer", "minimum": 0},
        "y": {"type": "integer", "minimum": 0},
        "width": {"type": "integer", "minimum": 1},
        "height": {"type": "integer", "minimum": 1}
      }
    }
  }
}
