{
  "format": "asset-forge-runtime-atlas",
  "version": 1,
  "image": "atlas.png",
  "imageSize": {
    "width": 64,
    "height": 64
  },
  "frameCount": 1,
  "capabilities": {
    "trimOffsets": true,
    "clockwise90Rotation": true
  },
  "frames": [
    {
      "index": 0,
      "name": "hero_0.png",
      "atlasRegion": {
        "x": 10,
        "y": 20,
        "width": 6,
        "height": 8
      },
      "uv": {
        "u0": 0.15625,
        "v0": 0.3125,
        "u1": 0.25,
        "v1": 0.4375
      },
      "sourceRegion": {
        "width": 8,
        "height": 6
      },
      "sourceSize": {
        "width": 12,
        "height": 10
      },
      "trimOffset": {
        "x": 2,
        "y": 1
      },
      "rotation": {
        "rotated": true,
        "degreesClockwise": 90
      }
    }
  ]
}
